{
  "$schema": "http://json-schema.org/draft-07/schema#",
  "type": "object",
  "required": [
    "cve_id",
    "alias",
    "cvss_score",
    "published_date",
    "affected_software",
    "patched_versions",
    "cwe",
    "mitre_attack_ids"
  ],
  "properties": {
    "cve_id": {
      "type": "string"
    },
    "alias": {
      "type": "string"
    },
    "cvss_score": {
      "type": "number"
    },
    "published_date": {
      "type": "string",
      "format": "date"
    },
    "affected_software": {
      "type": "object",
      "properties": {
        "name": {
          "type": "string"
        },
        "versions": {
          "type": "array",
          "items": {
            "type": "string"
          }
        }
      },
      "required": [
        "name",
        "versions"
      ]
    },
    "patched_versions": {
      "type": "array",
      "items": {
        "type": "string"
      }
    },
    "cwe": {
      "type": "string"
    },
    "mitre_attack_ids": {
      "type": "array",
      "items": {
        "type": "string"
      }
    }
  }
}