{
  "cve_id": "CVE-2021-44228",
  "alias": "Log4Shell",
  "cvss_score": 10.0,
  "published_date": "2021-12-10",
  "affected_software": {
    "name": "Apache Log4j",
    "versions": [
      "2.0-beta9",
      "2.14.1"
    ]
  },
  "patched_versions": [
    "2.15.0",
    "2.16.0",
    "2.17.0"
  ],
  "cwe": "CWE-502",
  "mitre_attack_ids": [
    "T1190",
    "T1059",
    "T1071",
    "T1210"
  ]
}